timestamp	status	val_score	val_rollout_nmse	val_deriv_nmse	val_worst_case_rollout_nmse	complexity	training_seconds	total_seconds	peak_vram_mb	num_steps	num_params_M	dashboard_path	progress_path	trial_dir	config_summary	reasoning_quote	notes	conclusion
2026-05-20T11:59:39+0300	kept	1.442373370	1.053776468	0.347401080	2.177466311	84	234.6	382.2	0.0	767	0.0522	/home/yaadreb/GitHub/autoresearch/pinn-sindy-autoresearch-v1/outputs/dashboard.html	/home/yaadreb/GitHub/autoresearch/pinn-sindy-autoresearch-v1/outputs/research_progress.html	/home/yaadreb/GitHub/autoresearch/pinn-sindy-autoresearch-v1/runs/trials/2026-05-20T11-59-39p0300	architecture=mlp; hidden_dim=128; num_layers=4; activation=tanh; use_time_fourier=False; batch_size=1024; w_kinematic=0.05; w_smooth=0.0001; derivative_method=autograd; sindy_library=polynomial; sindy_degree=2; sindy_optimizer=stlsq; sindy_threshold=0.025; sindy_alpha=1e-05	Baseline zero-init MLP + polynomial STLSQ establishes the first valid reference; step forcing is the dominant rollout failure, so future work should target discontinuous-input generalization and physically structured friction terms.	arch=mlp, lib=polynomial, opt=stlsq, degree=2, threshold=0.025, deriv=autograd, time_fourier=False	Kept as baseline because it is the only completed run so far and gives finite metrics across all forcing families. The model is over-complex for a physical law and performs worst on step forcing, indicating the next experiment should improve input-discontinuity handling or add nonlinear friction/cubic spring features.
2026-05-20T12:41:59+0300	discarded	1000000000.000000000	1000000000.000000000	1000000000.000000000	1000000000.000000000	239	235.2	298.9	0.0	534	0.0522	/home/yaadreb/GitHub/autoresearch/pinn-sindy-autoresearch-v1/outputs/dashboard.html	/home/yaadreb/GitHub/autoresearch/pinn-sindy-autoresearch-v1/outputs/research_progress.html	/home/yaadreb/GitHub/autoresearch/pinn-sindy-autoresearch-v1/runs/trials/2026-05-20T12-41-59p0300	architecture=mlp; hidden_dim=128; num_layers=4; activation=tanh; use_time_fourier=False; batch_size=1024; w_kinematic=0.05; w_smooth=0.0001; derivative_method=autograd; sindy_library=polynomial; sindy_degree=3; sindy_use_relative_features=True; sindy_optimizer=stlsq; sindy_threshold=0.05; sindy_alpha=1e-05; post_enforce_kinematics=True	Degree-3 relative-coordinate SINDy with exact kinematics over-expanded the library; validation overflowed and the learned rollout diverged, so the idea is rejected despite physically cleaner position rows.	arch=mlp, lib=polynomial, opt=stlsq, degree=3, threshold=0.05, deriv=autograd, time_fourier=False	Discarded. The candidate exposed useful relative coordinates and enforced dx/dt rows, but the cubic cross-term library was too ill-conditioned for the autograd smoother derivatives and produced an unstable vector field with BAD_SCORE.
2026-05-20T12:52:41+0300	kept	1.401344734	1.014197678	0.349032154	2.328890176	67	235.2	456.3	0.0	735	0.0522	/home/yaadreb/GitHub/autoresearch/pinn-sindy-autoresearch-v1/outputs/dashboard.html	/home/yaadreb/GitHub/autoresearch/pinn-sindy-autoresearch-v1/outputs/research_progress.html	/home/yaadreb/GitHub/autoresearch/pinn-sindy-autoresearch-v1/runs/trials/2026-05-20T12-52-41p0300	architecture=mlp; hidden_dim=128; num_layers=4; activation=tanh; use_time_fourier=False; batch_size=1024; w_kinematic=0.05; w_smooth=0.0001; derivative_method=autograd; sindy_library=polynomial; sindy_degree=2; sindy_use_relative_features=True; sindy_optimizer=stlsq; sindy_threshold=0.035; sindy_alpha=1e-05; post_enforce_kinematics=True	Degree-2 relative-coordinate SINDy with exact kinematics improved score and reduced complexity versus baseline; step forcing worsened, but the lower average rollout and simpler model make it the new benchmark.	arch=mlp, lib=polynomial, opt=stlsq, degree=2, threshold=0.035, deriv=autograd, time_fourier=False	Kept as new best. Relative coordinates and exact kinematic rows reduced complexity from 84 to 67 and lowered val_score from 1.442373370 to 1.401344734. The regression remains weak on step forcing, so the next loop should target discontinuous-input robustness without expanding to unstable cubic cross terms.
2026-05-20T13:04:37+0300	discarded	1000000000.000000000	1000000000.000000000	1000000000.000000000	1000000000.000000000	116	234.9	465.6	0.0	671	0.0522	/home/yaadreb/GitHub/autoresearch/pinn-sindy-autoresearch-v1/outputs/dashboard.html	/home/yaadreb/GitHub/autoresearch/pinn-sindy-autoresearch-v1/outputs/research_progress.html	/home/yaadreb/GitHub/autoresearch/pinn-sindy-autoresearch-v1/runs/trials/2026-05-20T13-04-37p0300	architecture=mlp; hidden_dim=128; num_layers=4; activation=tanh; use_time_fourier=False; batch_size=1024; w_kinematic=0.05; w_smooth=0.0001; derivative_method=autograd; sindy_library=poly_friction; sindy_degree=2; sindy_use_relative_features=True; sindy_optimizer=stlsq; sindy_threshold=0.04; sindy_alpha=1e-05; post_enforce_kinematics=True	Polynomial plus unary friction terms produced a dense high-gain vector field and diverged in validation; direct tanh/drag features are too ill-conditioned with the current smoother derivatives.	arch=mlp, lib=poly_friction, opt=stlsq, degree=2, threshold=0.04, deriv=autograd, time_fourier=False	Discarded. The feature idea is physically motivated, but adding tanh, quadratic drag, and unary cubic terms to every coordinate overfits the smoother derivatives and creates unstable validation rollouts. Keep the degree-2 relative-coordinate model as the benchmark.
2026-05-20T14:22:20+0300	discarded	1.419123891	1.026285235	0.357575969	2.294446641	74	234.7	466.4	0.0	738	0.0522	/home/yaadreb/GitHub/autoresearch/pinn-sindy-autoresearch-v1/outputs/dashboard.html	/home/yaadreb/GitHub/autoresearch/pinn-sindy-autoresearch-v1/outputs/research_progress.html	/home/yaadreb/GitHub/autoresearch/pinn-sindy-autoresearch-v1/runs/trials/2026-05-20T14-22-20p0300	experiment_preset=current_best_verify; architecture=mlp; hidden_dim=128; num_layers=4; activation=tanh; use_time_fourier=False; batch_size=1024; w_kinematic=0.05; w_smooth=0.0001; derivative_method=autograd; sindy_library=polynomial; sindy_degree=2; sindy_use_relative_features=True; sindy_optimizer=stlsq; sindy_threshold=0.035; sindy_alpha=1e-05; post_enforce_kinematics=True	current_best_verify: Re-run the current best degree-2 relative-coordinate model to estimate CPU-run variance. Result 
